title,year,genres,description,director,stars,certificate,duration,imdb_rating,metascore_rating,votes,gross,poster
Ferris Bueller's Day Off,1986,Comedy,"A high school wise guy is determined to have a day off from school, despite what the Principal thinks of that.",John Hughes,"Matthew Broderick, Alan Ruck, Mia Sara, Jeffrey Jones",PG-13,6180,7.8,61,351726,70136369,https://m.media-amazon.com/images/S/sash/4FyxwxECzL-U1J8.png
The Breakfast Club,1985,"Comedy, Drama",Five high school students meet in Saturday detention and discover how they have a lot more in common than they thought.,John Hughes,"Emilio Estevez, Judd Nelson, Molly Ringwald, Ally Sheedy",R,5820,7.8,66,390832,45875171,https://m.media-amazon.com/images/S/sash/4FyxwxECzL-U1J8.png
The Killing Fields,1984,"Biography, Drama, History","A journalist is trapped in Cambodia during tyrant Pol Pot's bloody 'Year Zero' cleansing campaign, which claimed the lives of two million 'undesirable' civilians.",Roland Joffé,"Sam Waterston, Haing S. Ngor, John Malkovich, Julian Sands",R,8460,7.8,76,55376,34700291,https://m.media-amazon.com/images/S/sash/4FyxwxECzL-U1J8.png
Ghostbusters,1984,"Action, Comedy, Fantasy","Three parapsychologists forced out of their university funding set up shop as a unique ghost removal service in New York City, attracting frightened yet skeptical customers.",Ivan Reitman,"Bill Murray, Dan Aykroyd, Sigourney Weaver, Harold Ramis",PG,6300,7.8,71,407891,238632124,https://m.media-amazon.com/images/S/sash/4FyxwxECzL-U1J8.png
The Right Stuff,1983,"Adventure, Biography, Drama","The U.S. space program's development from the breaking of the sound barrier to selection of the Mercury 7 astronauts, from a group of test pilots with a more seat-of-the-pants approach than the program's more cautious engineers preferred.",Philip Kaufman,"Sam Shepard, Scott Glenn, Ed Harris, Dennis Quaid",PG,11580,7.8,91,61283,21500000,https://m.media-amazon.com/images/S/sash/4FyxwxECzL-U1J8.png
The King of Comedy,1982,"Comedy, Crime, Drama","Rupert Pupkin is a passionate yet unsuccessful comic who craves nothing more than to be in the spotlight and to achieve this, he stalks and kidnaps his idol to take the spotlight for himself.",Martin Scorsese,"Robert De Niro, Jerry Lewis, Diahnne Abbott, Sandra Bernhard",PG,6540,7.8,73,101969,2500000,https://m.media-amazon.com/images/S/sash/4FyxwxECzL-U1J8.png
Kramer vs. Kramer,1979,Drama,"After his wife leaves him, a work-obsessed Manhattan advertising executive is forced to learn long-neglected parenting skills, but a heated custody battle over the couple's young son deepens the wounds left by the separation.",Robert Benton,"Dustin Hoffman, Meryl Streep, Jane Alexander, Justin Henry",PG,6300,7.8,77,144255,106260000,https://m.media-amazon.com/images/S/sash/4FyxwxECzL-U1J8.png
All That Jazz,1979,"Drama, Music, Musical","Director/choreographer Bob Fosse tells his own life story as he details the sordid career of Joe Gideon, a womanizing, drug-using dancer.",Bob Fosse,"Roy Scheider, Jessica Lange, Ann Reinking, Leland Palmer",R,7380,7.8,72,31694,37823676,https://m.media-amazon.com/images/S/sash/4FyxwxECzL-U1J8.png
Days of Heaven,1978,"Drama, Romance",A hot-tempered farm laborer convinces the woman he loves to marry their rich but dying boss so that they can have a claim to his fortune.,Terrence Malick,"Richard Gere, Brooke Adams, Sam Shepard, Linda Manz",PG,5640,7.8,93,57838,37823676,https://m.media-amazon.com/images/S/sash/4FyxwxECzL-U1J8.png
Dawn of the Dead,1978,"Horror, Thriller","Following an ever-growing epidemic of zombies that have risen from the dead, two Philadelphia S.W.A.T. team members, a traffic reporter, and his television executive girlfriend seek refuge in a secluded shopping mall.",George A. Romero,"David Emge, Ken Foree, Scott H. Reiniger, Gaylen Ross",Unrated,7620,7.8,71,119625,5100000,https://m.media-amazon.com/images/S/sash/4FyxwxECzL-U1J8.png
The Outlaw Josey Wales,1976,Western,Missouri farmer Josey Wales joins a Confederate guerrilla unit and winds up on the run from the Union soldiers who murdered his family.,Clint Eastwood,"Clint Eastwood, Sondra Locke, Chief Dan George, Bill McKinney",PG,8100,7.8,69,73103,31800000,https://m.media-amazon.com/images/S/sash/4FyxwxECzL-U1J8.png
The Man Who Would Be King,1975,"Adventure, History, War","Two former British soldiers in 1880s India decide to set themselves up as Kings in Kafiristan, a land where no white man has set foot since Alexander the Great.",John Huston,"Sean Connery, Michael Caine, Christopher Plummer, Saeed Jaffrey",PG,7740,7.8,91,48794,31800000,https://m.media-amazon.com/images/S/sash/4FyxwxECzL-U1J8.png
The Holy Mountain,1973,"Adventure, Drama, Fantasy","In a corrupt, greed-fueled world, a powerful alchemist leads a messianic character and seven materialistic figures to the Holy Mountain, where they hope to achieve enlightenment.",Alejandro Jodorowsky,"Alejandro Jodorowsky, Horacio Salinas, Zamira Saunders, Juan Ferrara",R,6840,7.8,76,42555,61001,https://m.media-amazon.com/images/S/sash/4FyxwxECzL-U1J8.png
The Conversation,1974,"Drama, Mystery, Thriller","A paranoid, secretive surveillance expert has a crisis of conscience when he suspects that the couple he is spying on will be murdered.",Francis Ford Coppola,"Gene Hackman, John Cazale, Allen Garfield, Frederic Forrest",PG,6780,7.8,87,110819,4420000,https://m.media-amazon.com/images/S/sash/4FyxwxECzL-U1J8.png
The Day of the Jackal,1973,"Crime, Drama, Thriller","In the aftermath of France allowing Algeria's independence, a group of resentful military veterans hire a professional assassin codenamed ""Jackal"" to kill President Charles de Gaulle.",Fred Zinnemann,"Edward Fox, Terence Alexander, Michel Auclair, Alan Badel",PG,8580,7.8,80,40848,16056255,https://m.media-amazon.com/images/S/sash/4FyxwxECzL-U1J8.png
The Discreet Charm of the Bourgeoisie,1972,Comedy,"A surreal, virtually plotless series of dreams centered around six middle-class people and their consistently interrupted attempts to have a meal together.",Luis Buñuel,"Fernando Rey, Delphine Seyrig, Paul Frankeur, Bulle Ogier",PG,6120,7.8,93,42799,198809,https://m.media-amazon.com/images/S/sash/4FyxwxECzL-U1J8.png
Cabaret,1972,"Drama, Music, Musical",A female girlie club entertainer in Weimar Republic era Berlin romances two men while the Nazi Party rises to power around them.,Bob Fosse,"Liza Minnelli, Michael York, Helmut Griem, Joel Grey",PG,7440,7.8,80,54779,42765000,https://m.media-amazon.com/images/S/sash/4FyxwxECzL-U1J8.png
"Aguirre, the Wrath of God",1972,"Action, Adventure, Biography","In the 16th century, the ruthless and insane Don Lope de Aguirre leads a Spanish expedition in search of El Dorado.",Werner Herzog,"Klaus Kinski, Ruy Guerra, Helena Rojo, Del Negro",Not Rated,5700,7.8,80,56882,42765000,https://m.media-amazon.com/images/S/sash/4FyxwxECzL-U1J8.png
Willy Wonka & the Chocolate Factory,1971,"Family, Fantasy, Musical",A poor but hopeful boy seeks one of the five coveted golden tickets that will send him on a tour of Willy Wonka's mysterious chocolate factory.,Mel Stuart,"Gene Wilder, Jack Albertson, Peter Ostrum, Roy Kinnear",G,6000,7.8,67,198740,4000000,https://m.media-amazon.com/images/S/sash/4FyxwxECzL-U1J8.png
Midnight Cowboy,1969,Drama,"A naive hustler travels from Texas to New York City to seek personal fortune, finding a new friend in the process.",John Schlesinger,"Dustin Hoffman, Jon Voight, Sylvia Miles, John McGiver",R,6780,7.8,79,110339,44785053,https://m.media-amazon.com/images/S/sash/4FyxwxECzL-U1J8.png
Night of the Living Dead,1968,"Horror, Thriller",A ragtag group of Pennsylvanians barricade themselves in an old farmhouse to remain safe from a horde of flesh-eating ghouls that are ravaging the East Coast of the United States.,George A. Romero,"Duane Jones, Judith O'Dea, Karl Hardman, Marilyn Eastman",Not Rated,5760,7.8,89,126934,89029,https://m.media-amazon.com/images/S/sash/4FyxwxECzL-U1J8.png
Guess Who's Coming to Dinner,1967,"Comedy, Drama",A couple's attitudes are challenged when their daughter introduces them to her African-American fiancé.,Stanley Kramer,"Spencer Tracy, Sidney Poitier, Katharine Hepburn, Katharine Houghton",Approved,6480,7.8,63,45109,56700000,https://m.media-amazon.com/images/S/sash/4FyxwxECzL-U1J8.png
The Umbrellas of Cherbourg,1964,"Drama, Musical, Romance",A young woman separated from her lover by war faces a life-altering decision.,Jacques Demy,"Catherine Deneuve, Nino Castelnuovo, Anne Vernon, Marc Michel",Not Rated,5460,7.8,86,27455,28030,https://m.media-amazon.com/images/S/sash/4FyxwxECzL-U1J8.png
My Fair Lady,1964,"Drama, Family, Musical","In 1910s London, snobbish phonetics professor Henry Higgins agrees to a wager that he can make crude flower girl, Eliza Doolittle, presentable in high society.",George Cukor,"Audrey Hepburn, Rex Harrison, Stanley Holloway, Wilfrid Hyde-White",G,10200,7.8,95,95035,72000000,https://m.media-amazon.com/images/S/sash/4FyxwxECzL-U1J8.png
Mary Poppins,1964,"Comedy, Family, Fantasy","In turn of the century London, a magical nanny employs music and adventure to help two neglected children become closer to their father.",Robert Stevenson,"Julie Andrews, Dick Van Dyke, David Tomlinson, Glynis Johns",G,8340,7.8,88,170688,102272727,https://m.media-amazon.com/images/S/sash/4FyxwxECzL-U1J8.png
The Innocents,1961,Horror,A young governess for two children becomes convinced that the house and grounds are haunted.,Jack Clayton,"Deborah Kerr, Peter Wyngarde, Megs Jenkins, Michael Redgrave",Not Rated,6000,7.8,88,30182,2616000,https://m.media-amazon.com/images/S/sash/4FyxwxECzL-U1J8.png
L'Avventura,1960,"Drama, Mystery, Romance","A woman disappears during a Mediterranean boating trip. During the search, her lover and her best friend become attracted to each other.",Michelangelo Antonioni,"Gabriele Ferzetti, Monica Vitti, Lea Massari, Dominique Blanchar",Not Rated,8640,7.8,88,29641,2616000,https://m.media-amazon.com/images/S/sash/4FyxwxECzL-U1J8.png
East of Eden,1955,Drama,"Two brothers in 1910s California struggle to maintain their strict, Bible-toting father's favor as an old secret about their long-absent mother comes to light.",Elia Kazan,"James Dean, Raymond Massey, Julie Harris, Burl Ives",PG,7080,7.8,72,45323,2616000,https://m.media-amazon.com/images/S/sash/4FyxwxECzL-U1J8.png
The Day the Earth Stood Still,1951,"Drama, Sci-Fi","An alien lands in Washington, D.C. and tells the people of Earth that they must live peacefully or be destroyed as a danger to other planets.",Robert Wise,"Michael Rennie, Patricia Neal, Hugh Marlowe, Sam Jaffe",G,5520,7.8,72,81513,2616000,https://m.media-amazon.com/images/S/sash/4FyxwxECzL-U1J8.png
The Asphalt Jungle,1950,"Crime, Drama, Film-Noir","A major heist goes off as planned, but then double crosses, bad luck and solid police work cause everything to unravel.",John Huston,"Sterling Hayden, Louis Calhern, Jean Hagen, James Whitmore",Passed,6720,7.8,85,27010,2616000,https://m.media-amazon.com/images/S/sash/4FyxwxECzL-U1J8.png
Red River,1948,"Drama, Western","Dunson leads a cattle drive, the culmination of over 14 years of work, to its destination in Missouri. But his tyrannical behavior along the way causes a mutiny, led by his adopted son.",Howard Hawks,"|, John Wayne, Montgomery Clift, Joanne Dru, Walter Brennan",Passed,7980,7.8,85,31142,2616000,https://m.media-amazon.com/images/S/sash/4FyxwxECzL-U1J8.png
To Have and Have Not,1944,"Adventure, Comedy, Film-Noir","During World War II, American expatriate Harry Morgan helps transport a French Resistance leader and his beautiful wife to Martinique while romancing a sensuous lounge singer.",Howard Hawks,"Humphrey Bogart, Lauren Bacall, Walter Brennan, Dolores Moran",Passed,6000,7.8,90,34531,2616000,https://m.media-amazon.com/images/S/sash/4FyxwxECzL-U1J8.png
Gaslight,1944,"Crime, Drama, Mystery","Ten years after her aunt was murdered in their London home, a woman returns from Italy in the 1880s to resume residence with her new husband. His obsessive interest in the home rises from a secret that may require driving his wife insane.",George Cukor,"Charles Boyer, Ingrid Bergman, Joseph Cotten, May Whitty",Passed,6840,7.8,90,28637,2616000,https://m.media-amazon.com/images/S/sash/4FyxwxECzL-U1J8.png
Shadow of a Doubt,1943,"Film-Noir, Thriller","A teenage girl, overjoyed when her favorite uncle comes to visit the family in their quiet California town, slowly begins to suspect that he is in fact the ""Merry Widow"" killer sought by the authorities.",Alfred Hitchcock,"Teresa Wright, Joseph Cotten, Macdonald Carey, Henry Travers",Passed,6480,7.8,94,65094,2616000,https://m.media-amazon.com/images/S/sash/4FyxwxECzL-U1J8.png
His Girl Friday,1940,"Comedy, Drama, Romance",A newspaper editor uses every trick in the book to keep his ace reporter ex-wife from remarrying.,Howard Hawks,"Cary Grant, Rosalind Russell, Ralph Bellamy, Gene Lockhart",Passed,5520,7.8,94,58375,296000,https://m.media-amazon.com/images/S/sash/4FyxwxECzL-U1J8.png
Stagecoach,1939,"Adventure, Drama, Western",A group of people traveling on a stagecoach find their journey complicated by the threat of Geronimo and learn something about each other in the process.,John Ford,"John Wayne, Claire Trevor, Andy Devine, John Carradine",Passed,5760,7.8,93,48701,296000,https://m.media-amazon.com/images/S/sash/4FyxwxECzL-U1J8.png
You Can't Take It with You,1938,"Comedy, Drama, Romance","The son of a snobbish Wall Street banker becomes engaged to a woman from a good-natured but decidedly eccentric family, not realizing that his father is trying to force her family from their home for a real estate development.",Frank Capra,"Jean Arthur, James Stewart, Lionel Barrymore, Edward Arnold",Passed,7560,7.8,93,25760,4659913,https://m.media-amazon.com/images/S/sash/4FyxwxECzL-U1J8.png
The Lady Vanishes,1938,"Mystery, Thriller","While travelling in continental Europe, a rich young playgirl realizes that an elderly lady seems to have disappeared from the train.",Alfred Hitchcock,"Margaret Lockwood, Michael Redgrave, Paul Lukas, May Whitty",Not Rated,5760,7.8,98,52334,4659913,https://m.media-amazon.com/images/S/sash/4FyxwxECzL-U1J8.png
Bringing Up Baby,1938,Comedy,"While trying to secure a $1 million donation for his museum, a befuddled paleontologist is pursued by a flighty and often irritating heiress and her pet leopard, Baby.",Howard Hawks,"Katharine Hepburn, Cary Grant, Charles Ruggles, Walter Catlett",Passed,6120,7.8,91,61236,4659913,https://m.media-amazon.com/images/S/sash/4FyxwxECzL-U1J8.png
A Night at the Opera,1935,"Comedy, Music, Musical",A sly business manager and the wacky friends of two opera singers in Italy help them achieve success in America while humiliating their stuffy and snobbish enemies.,Sam Wood,"|, Groucho Marx, Chico Marx, Harpo Marx, Kitty Carlisle",Passed,5760,7.8,91,32833,2537520,https://m.media-amazon.com/images/S/sash/4FyxwxECzL-U1J8.png
The Bride of Frankenstein,1935,"Drama, Horror, Sci-Fi","Mary Shelley reveals the main characters of her novel survived: Dr. Frankenstein, goaded by an even madder scientist, builds his monster a mate.",James Whale,"Boris Karloff, Elsa Lanchester, Colin Clive, Valerie Hobson",Not Rated,4500,7.8,95,47796,4360000,https://m.media-amazon.com/images/S/sash/4FyxwxECzL-U1J8.png
Duck Soup,1933,"Comedy, Musical","Rufus T. Firefly is named the dictator of bankrupt Freedonia and declares war on neighboring Sylvania over the love of his wealthy backer Mrs. Teasdale, contending with two inept spies who can't seem to keep straight which side they're on.",Leo McCarey,"Groucho Marx, Harpo Marx, Chico Marx, Zeppo Marx",Not Rated,4140,7.8,93,59951,4360000,https://m.media-amazon.com/images/S/sash/4FyxwxECzL-U1J8.png
Frankenstein,1931,"Drama, Horror, Sci-Fi",Dr. Frankenstein dares to tamper with life and death by creating a human monster out of lifeless body parts.,James Whale,"Colin Clive, Mae Clarke, Boris Karloff, John Boles",Passed,4200,7.8,91,71596,4360000,https://m.media-amazon.com/images/S/sash/4FyxwxECzL-U1J8.png
Roma,2018,Drama,A year in the life of a middle-class family's maid in Mexico City in the early 1970s.,Alfonso Cuarón,"Yalitza Aparicio, Marina de Tavira, Diego Cortina Autrey, Carlos Peralta",R,8100,7.7,96,155952,4360000,https://m.media-amazon.com/images/S/sash/4FyxwxECzL-U1J8.png
Deadpool 2,2018,"Action, Adventure, Comedy","Foul-mouthed mutant mercenary Wade Wilson (a.k.a. Deadpool) assembles a team of fellow mutant rogues to protect a young boy with supernatural abilities from the brutal, time-traveling cyborg Cable.",David Leitch,"Ryan Reynolds, Josh Brolin, Morena Baccarin, Julian Dennison",R,7140,7.7,66,562501,324591735,https://m.media-amazon.com/images/S/sash/4FyxwxECzL-U1J8.png
Sound of Metal,2019,"Drama, Music",A heavy-metal drummer's life is thrown into freefall when he begins to lose his hearing.,Darius Marder,"Riz Ahmed, Olivia Cooke, Paul Raci, Lauren Ridloff",R,7200,7.7,82,121509,324591735,https://m.media-amazon.com/images/S/sash/4FyxwxECzL-U1J8.png
Wind River,2017,"Crime, Drama, Mystery",A veteran hunter helps an FBI agent investigate the murder of a young woman on a Wyoming Native American reservation.,Taylor Sheridan,"Elizabeth Olsen, Jeremy Renner, Graham Greene, Kelsey Asbille",R,6420,7.7,73,246510,33800859,https://m.media-amazon.com/images/S/sash/4FyxwxECzL-U1J8.png
The Salesman,2016,Drama,"While Ranaa and Emad, a married couple, are participating in a production of ""Death of a Salesman,"" she is assaulted in their new home, which leaves him determined to find the perpetrator over his wife's traumatized objections.",Asghar Farhadi,"Shahab Hosseini, Taraneh Alidoosti, Mina Sadati, Babak Karimi",PG-13,7440,7.7,85,60177,2402067,https://m.media-amazon.com/images/S/sash/4FyxwxECzL-U1J8.png
Get Out,2017,"Horror, Mystery, Thriller","A young African-American visits his white girlfriend's parents for the weekend, where his simmering uneasiness about their reception of him eventually reaches a boiling point.",Jordan Peele,"Daniel Kaluuya, Allison Williams, Bradley Whitford, Catherine Keener",R,6240,7.7,85,570427,176040665,https://m.media-amazon.com/images/S/sash/4FyxwxECzL-U1J8.png
Mission: Impossible - Fallout,2018,"Action, Adventure, Thriller","Ethan Hunt and his IMF team, along with some familiar allies, race against time after a mission gone wrong.",Christopher McQuarrie,"Tom Cruise, Henry Cavill, Ving Rhames, Simon Pegg",PG-13,8820,7.7,86,326035,220159104,https://m.media-amazon.com/images/S/sash/4FyxwxECzL-U1J8.png
Perfect Strangers,2016,"Comedy, Drama","Seven long-time friends meet for dinner. They decide to share their text messages, emails and phone calls. Secrets are unveiled. Harmony trembles.",Paolo Genovese,"Giuseppe Battiston, Anna Foglietta, Marco Giallini, Edoardo Leo",16,5760,7.7,86,64663,220159104,https://m.media-amazon.com/images/S/sash/4FyxwxECzL-U1J8.png
Udta Punjab,2016,"Action, Crime, Drama",A story that revolves around drug abuse in the affluent north Indian State of Punjab and how the youth there have succumbed to it en-masse resulting in a socio-economic decline.,Abhishek Chaubey,"Shahid Kapoor, Alia Bhatt, Kareena Kapoor, Diljit Dosanjh",Not Rated,8880,7.7,86,30313,220159104,https://m.media-amazon.com/images/S/sash/4FyxwxECzL-U1J8.png
Kubo and the Two Strings,2016,"Animation, Action, Adventure",A young boy named Kubo must locate a magical suit of armour worn by his late father in order to defeat a vengeful spirit from the past.,Travis Knight,"Charlize Theron, Art Parkinson, Matthew McConaughey, Ralph Fiennes",PG,6060,7.7,84,128012,48023088,https://m.media-amazon.com/images/S/sash/4FyxwxECzL-U1J8.png
A Man Called Ove,2015,"Comedy, Drama, Romance","Ove, an ill-tempered, isolated retiree who spends his days enforcing block association rules and visiting his wife's grave, has finally given up on life just as an unlikely friendship develops with his boisterous new neighbors.",Hannes Holm,"Rolf Lassgård, Bahar Pars, Filip Berg, Ida Engvoll",PG-13,6960,7.7,70,54385,3358518,https://m.media-amazon.com/images/S/sash/4FyxwxECzL-U1J8.png
When Marnie Was There,2014,"Animation, Drama, Family","Due to 12 y.o. Anna's asthma, she's sent to stay with relatives of her guardian in the Japanese countryside. She likes to be alone, sketching. She befriends Marnie. Who is the mysterious, blonde Marnie.",Hiromasa Yonebayashi,"Sara Takatsuki, Kasumi Arimura, Nanako Matsushima, Susumu Terajima",PG,6180,7.7,72,39919,765127,https://m.media-amazon.com/images/S/sash/4FyxwxECzL-U1J8.png
The Theory of Everything,2014,"Biography, Drama, Romance",A look at the relationship between the famous physicist Stephen Hawking and his wife.,James Marsh,"Eddie Redmayne, Felicity Jones, Tom Prior, Sophie Perry",PG-13,7380,7.7,71,443980,35893537,https://m.media-amazon.com/images/S/sash/4FyxwxECzL-U1J8.png
Kingsman: The Secret Service,2014,"Action, Adventure, Comedy","A spy organisation recruits a promising street kid into the agency's training program, while a global threat emerges from a twisted tech genius.",Matthew Vaughn,"Colin Firth, Taron Egerton, Samuel L. Jackson, Michael Caine",R,7740,7.7,60,657288,128261724,https://m.media-amazon.com/images/S/sash/4FyxwxECzL-U1J8.png
The Fault in Our Stars,2014,"Drama, Romance",Two teenage cancer patients begin a life-affirming journey to visit a reclusive author in Amsterdam.,Josh Boone,"Shailene Woodley, Ansel Elgort, Nat Wolff, Laura Dern",PG-13,7560,7.7,69,371842,124872350,https://m.media-amazon.com/images/S/sash/4FyxwxECzL-U1J8.png
Me and Earl and the Dying Girl,2015,"Comedy, Drama","High schooler Greg, who spends most of his time making parodies of classic movies with his co-worker Earl, finds his outlook forever altered after befriending a classmate who has just been diagnosed with cancer.",Alfonso Gomez-Rejon,"Thomas Mann, RJ Cyler, Olivia Cooke, Nick Offerman",PG-13,6300,7.7,74,130948,6743776,https://m.media-amazon.com/images/S/sash/4FyxwxECzL-U1J8.png
Birdman or (The Unexpected Virtue of Ignorance),2014,"Comedy, Drama","A washed-up superhero actor attempts to revive his fading career by writing, directing, and starring in a Broadway production.",Alejandro G. Iñárritu,"Michael Keaton, Zach Galifianakis, Edward Norton, Andrea Riseborough",R,7140,7.7,87,621827,42340598,https://m.media-amazon.com/images/S/sash/4FyxwxECzL-U1J8.png
The Past,2013,"Drama, Mystery","An Iranian man deserts his French wife and her two children to return to his homeland. Meanwhile, his wife starts up a new relationship, a reality her husband confronts upon his wife's request for a divorce.",Asghar Farhadi,"Bérénice Bejo, Tahar Rahim, Ali Mosaffa, Pauline Burlet",PG-13,7800,7.7,85,48837,1330596,https://m.media-amazon.com/images/S/sash/4FyxwxECzL-U1J8.png
The Great Beauty,2013,Drama,"Jep Gambardella has seduced his way through the lavish nightlife of Rome for decades, but after his 65th birthday and a shock from the past, Jep looks past the nightclubs and parties to find a timeless landscape of absurd, exquisite beauty.",Paolo Sorrentino,"Toni Servillo, Carlo Verdone, Sabrina Ferilli, Carlo Buccirosso",Not Rated,8460,7.7,86,90036,2852400,https://m.media-amazon.com/images/S/sash/4FyxwxECzL-U1J8.png
Blue Is the Warmest Colour,2013,"Drama, Romance","Adèle's life is changed when she meets Emma, a young woman with blue hair, who will allow her to discover desire and to assert herself as a woman and as an adult. In front of others, Adèle grows, seeks herself, loses herself, and ultimately finds herself through love and loss.",Abdellatif Kechiche,"Léa Seydoux, Adèle Exarchopoulos, Salim Kechiouche, Aurélien Recoing",NC-17,10800,7.7,89,150839,2199675,https://m.media-amazon.com/images/S/sash/4FyxwxECzL-U1J8.png
The Broken Circle Breakdown,2012,"Drama, Music, Romance","Elise and Didier fall in love at first sight, in spite of their differences. He talks, she listens. He's a romantic atheist, she's a religious realist. When their daughter becomes seriously ill, their love is put on trial.",Felix van Groeningen,"Veerle Baetens, Johan Heldenbergh, Nell Cattrysse, Geert Van Rampelberg",Not Rated,6660,7.7,70,41118,175058,https://m.media-amazon.com/images/S/sash/4FyxwxECzL-U1J8.png
The Wind Rises,2013,"Animation, Biography, Drama","A look at the life of Jiro Horikoshi, the man who designed Japanese fighter planes during World War II.",Hayao Miyazaki,"Hideaki Anno, Hidetoshi Nishijima, Miori Takimoto, Masahiko Nishimura",PG-13,7560,7.7,83,84440,5209580,https://m.media-amazon.com/images/S/sash/4FyxwxECzL-U1J8.png
Toy Story 4,2019,"Animation, Adventure, Comedy","When a new toy called ""Forky"" joins Woody and the gang, a road trip alongside old and new friends reveals how big the world can be for a toy.",Josh Cooley,"Tom Hanks, Tim Allen, Annie Potts, Tony Hale",G,6000,7.7,84,243305,434038008,https://m.media-amazon.com/images/S/sash/4FyxwxECzL-U1J8.png
Nebraska,2013,"Adventure, Comedy, Drama","An aging, booze-addled father makes the trip from Montana to Nebraska with his estranged son in order to claim a million-dollar Mega Sweepstakes Marketing prize.",Alexander Payne,"Bruce Dern, Will Forte, June Squibb, Bob Odenkirk",R,6900,7.7,87,117868,17654912,https://m.media-amazon.com/images/S/sash/4FyxwxECzL-U1J8.png
Wreck-It Ralph,2012,"Animation, Adventure, Comedy","A video game villain wants to be a hero and sets out to fulfill his dream, but his quest brings havoc to the whole arcade where he lives.",Rich Moore,"John C. Reilly, Jack McBrayer, Jane Lynch, Sarah Silverman",PG,6060,7.7,72,415960,189422889,https://m.media-amazon.com/images/S/sash/4FyxwxECzL-U1J8.png
